{
  "deviations": [
    {
      "deviation_id": "D-001",
      "rule_id": "R-010",
      "doc_id": "DOC-01",
      "clause_anchor": {
        "section": "6",
        "span": "Vendor will provide internal onboarding materials to personnel assigned to the service."
      },
      "original_text": "Vendor will ensure those personnel are bound by confidentiality obligations and receive privacy and security training appropriate to their roles.",
      "mutated_text": "Vendor will provide internal onboarding materials to personnel assigned to the service.",
      "mechanism": "omission",
      "severity": "high",
      "expected_action": "redline_with_fallback"
    },
    {
      "deviation_id": "D-002",
      "rule_id": "R-003",
      "doc_id": "DOC-01",
      "clause_anchor": {
        "section": "7",
        "span": "Vendor may appoint outside hosting, support, and operations providers after giving Customer a courtesy update. Vendor remains responsible for service availability."
      },
      "original_text": "Vendor may use subprocessors only with Customer's prior written approval or through an agreed notice-and-objection process. Vendor will bind each subprocessor to written obligations at least as protective as this DPA for Personal Data and remains responsible for each subprocessor's acts and omissions.",
      "mutated_text": "Vendor may appoint outside hosting, support, and operations providers after giving Customer a courtesy update. Vendor remains responsible for service availability.",
      "mechanism": "omission",
      "severity": "high",
      "expected_action": "redline_with_fallback"
    },
    {
      "deviation_id": "D-003",
      "rule_id": "R-008",
      "doc_id": "DOC-01",
      "clause_anchor": {
        "section": "10",
        "span": "After annual assurance materials are delivered, no further control review is available for the same contract year unless Vendor agrees in writing."
      },
      "original_text": "On at least 30 days' notice, Customer or its independent assessor may audit or inspect controls relevant to Personal Data no more than once per year, and more frequently after a material incident, regulatory request, or reasonable cause.",
      "mutated_text": "After annual assurance materials are delivered, no further control review is available for the same contract year unless Vendor agrees in writing.",
      "mechanism": "cross_ref_override",
      "severity": "medium",
      "expected_action": "redline_with_fallback"
    },
    {
      "deviation_id": "D-004",
      "rule_id": "R-012",
      "doc_id": "DOC-01",
      "clause_anchor": {
        "section": "14",
        "span": "For matters arising under this addendum, total recovery against Vendor will not exceed fees paid for the affected service during the three months before the event, and consequential loss is unavailable."
      },
      "original_text": "Claims arising from Vendor's breach of this DPA are subject to the liability cap and exclusions stated in the master services agreement and are not subject to any lower cap, special exclusion, or separate damages waiver for data protection obligations.",
      "mutated_text": "For matters arising under this addendum, total recovery against Vendor will not exceed fees paid for the affected service during the three months before the event, and consequential loss is unavailable.",
      "mechanism": "direct_term_swap",
      "severity": "high",
      "expected_action": "redline_with_fallback"
    },
    {
      "deviation_id": "D-005",
      "rule_id": "R-001",
      "doc_id": "DOC-01",
      "clause_anchor": {
        "section": "2",
        "span": "\"Processing\" means live hosting of raw individual records in the production database and does not include diagnostic review, metric creation, cache retention, format conversion, or support troubleshooting."
      },
      "original_text": "\"Processing\" means any operation performed on Personal Data, including collection, access, storage, hosting, organization, retrieval, transmission, analysis, deletion, and return.",
      "mutated_text": "\"Processing\" means live hosting of raw individual records in the production database and does not include diagnostic review, metric creation, cache retention, format conversion, or support troubleshooting.",
      "mechanism": "defined_term_shift",
      "severity": "critical",
      "expected_action": "redline_with_fallback"
    }
  ],
  "distractors": [
    {
      "distractor_id": "X-001",
      "doc_id": "DOC-01",
      "span": "Vendor will provide an annual SOC 2 Type II report, responses to reasonable security and privacy questionnaires, and other information reasonably necessary to demonstrate compliance with this DPA.",
      "why_benign": "The audit canary says an annual SOC 2 Type II report may satisfy routine assurance if follow-up rights remain available."
    },
    {
      "distractor_id": "X-002",
      "doc_id": "DOC-01",
      "span": "For up to 30 days after termination, Vendor will provide reasonable termination assistance to support secure transition, return, or deletion.",
      "why_benign": "The transition canary says a 30-day termination assistance period is acceptable."
    },
    {
      "distractor_id": "X-003",
      "doc_id": "DOC-01",
      "span": "If this DPA conflicts with the master services agreement regarding Personal Data, this DPA controls for that Processing.",
      "why_benign": "A DPA precedence clause for personal-data processing is customary and client-protective."
    }
  ],
  "missing_info": [
    {
      "missing_info_id": "M-002",
      "topic": "Current subprocessor list location",
      "context_anchor": "The vendor will use subprocessors to process customer personal data for the production service.",
      "match_keywords": [
        "subprocessor",
        "subprocessors",
        "portal",
        "list",
        "schedule"
      ],
      "absent_terms": [
        "subprocessor portal",
        "subprocessor schedule url",
        "current subprocessors list"
      ],
      "expected_action": "escalate"
    }
  ],
  "generation_log": [
    "seed=603",
    "attempt_seed=603",
    "playbook=PB-DPA-001",
    "tier=T2",
    "task_id=T2-DPA-603",
    "D-001 DPA-R010-OMISSION-PERSONNEL-CONF omission applied to R-010",
    "D-002 DPA-R003-OMISSION-FLOWDOWN omission applied to R-003",
    "D-003 DPA-R008-CROSS-AUDIT-LIMIT cross_ref_override applied to R-008",
    "D-004 DPA-R012-DIRECT-LIABILITY direct_term_swap applied to R-012",
    "D-005 DPA-R011-DEFINED-PROCESSING defined_term_shift applied to R-001",
    "coherence_check PASS sections=15 cross_refs_resolved=yes anchors_resolved=yes"
  ]
}
