{
  "deviations": [
    {
      "deviation_id": "D-001",
      "rule_id": "R-006",
      "doc_id": "DOC-01",
      "clause_anchor": {
        "section": "15",
        "span": "Neither party waives any remedy by delaying enforcement, and operational notices may be delivered through the custody portal or by email to the notice contacts designated by the parties. Custodian's portal status page will be the exclusive source for operational-control information, and Custodian has no duty to provide supplemental evidence after incidents or control changes."
      },
      "original_text": "Neither party waives any remedy by delaying enforcement, and operational notices may be delivered through the custody portal or by email to the notice contacts designated by the parties.",
      "mutated_text": "Neither party waives any remedy by delaying enforcement, and operational notices may be delivered through the custody portal or by email to the notice contacts designated by the parties. Custodian's portal status page will be the exclusive source for operational-control information, and Custodian has no duty to provide supplemental evidence after incidents or control changes.",
      "mechanism": "off_playbook_addition",
      "severity": "medium",
      "expected_action": "redline_with_fallback"
    },
    {
      "deviation_id": "D-002",
      "rule_id": "R-008",
      "doc_id": "DOC-01",
      "clause_anchor": {
        "section": "2",
        "span": "\"Customer Assets\" means supported units recorded to Customer's primary custody account, excluding chain-split property, promotional distributions, validator proceeds, and other network-originated items unless Custodian separately credits them."
      },
      "original_text": "\"Customer Assets\" means all Digital Assets, private-key control rights, proceeds, forks, airdrops, staking rewards, and network distributions credited to or held for Customer.",
      "mutated_text": "\"Customer Assets\" means supported units recorded to Customer's primary custody account, excluding chain-split property, promotional distributions, validator proceeds, and other network-originated items unless Custodian separately credits them.",
      "mechanism": "defined_term_shift",
      "severity": "high",
      "expected_action": "redline_with_fallback"
    },
    {
      "deviation_id": "D-003",
      "rule_id": "R-002",
      "doc_id": "DOC-01",
      "clause_anchor": {
        "section": "8",
        "span": "Routine liquidity records may be maintained to support network fees, reconciliation, and pending transfer queues. Notwithstanding Section 3, Custodian may deploy idle balances for settlement liquidity, inventory smoothing, and collateral substitutions until a withdrawal is pending."
      },
      "original_text": "Routine liquidity records may be maintained to support network fees, reconciliation, and pending transfer queues, but those records do not permit Custodian to borrow, deploy, or encumber Customer Assets.",
      "mutated_text": "Routine liquidity records may be maintained to support network fees, reconciliation, and pending transfer queues. Notwithstanding Section 3, Custodian may deploy idle balances for settlement liquidity, inventory smoothing, and collateral substitutions until a withdrawal is pending.",
      "mechanism": "cross_ref_override",
      "severity": "critical",
      "expected_action": "redline_with_fallback"
    },
    {
      "deviation_id": "D-004",
      "rule_id": "R-005",
      "doc_id": "DOC-01",
      "clause_anchor": {
        "section": "9",
        "span": "Custodian will maintain commercially reasonable crime and technology coverage, with policy amounts, deductibles, exclusions, and covered causes determined by Custodian from time to time."
      },
      "original_text": "Custodian will maintain insurance covering theft, cyber compromise, insider misconduct, and key-loss events affecting Customer Assets with limits of at least the greater of $50,000,000 or the value of Customer Assets under custody.",
      "mutated_text": "Custodian will maintain commercially reasonable crime and technology coverage, with policy amounts, deductibles, exclusions, and covered causes determined by Custodian from time to time.",
      "mechanism": "direct_term_swap",
      "severity": "high",
      "expected_action": "redline_with_fallback"
    },
    {
      "deviation_id": "D-005",
      "rule_id": "R-003",
      "doc_id": "DOC-01",
      "clause_anchor": {
        "section": "5",
        "span": "Custodian will maintain account records showing balances credited to Customer and will make those records available through the custody portal."
      },
      "original_text": "Customer Assets are owned by Customer, are not property of Custodian, and are intended to be excluded from Custodian's bankruptcy estate to the fullest extent permitted by applicable law. Custodian will maintain records sufficient to identify Customer Assets as held for Customer.",
      "mutated_text": "Custodian will maintain account records showing balances credited to Customer and will make those records available through the custody portal.",
      "mechanism": "omission",
      "severity": "critical",
      "expected_action": "redline_with_fallback"
    }
  ],
  "distractors": [
    {
      "distractor_id": "X-001",
      "doc_id": "DOC-01",
      "span": "This Agreement is governed by the laws of the State of New York, without regard to conflict-of-laws rules.",
      "why_benign": "The governing-law canary says New York law is acceptable for this engagement."
    },
    {
      "distractor_id": "X-002",
      "doc_id": "DOC-01",
      "span": "Custodian will provide an annual SOC 2 Type II report or equivalent controls report covering custody operations, key management, logical access, change management, incident response, and vendor oversight.",
      "why_benign": "The assurance canary says annual SOC 2 Type II reporting may satisfy routine assurance when follow-up rights remain available."
    },
    {
      "distractor_id": "X-003",
      "doc_id": "DOC-01",
      "span": "Customer will provide reasonable AML, sanctions, tax, and KYC cooperation requested for the custody services.",
      "why_benign": "Reasonable customer cooperation for AML, sanctions, tax, and KYC support is commercially expected and does not expand Custodian's freeze rights."
    }
  ],
  "missing_info": [
    {
      "missing_info_id": "M-001",
      "topic": "Customer wallet-whitelisting approval policy",
      "context_anchor": "Customer also needs an internal policy describing wallet whitelisting approval before funds move.",
      "match_keywords": [
        "wallet whitelisting",
        "whitelist approval",
        "approved destination list"
      ],
      "absent_terms": [
        "wallet whitelisting",
        "whitelist approval",
        "approved destination list"
      ],
      "expected_action": "escalate"
    }
  ],
  "generation_log": [
    "seed=1502",
    "attempt_seed=1502",
    "playbook=PB-CRYPTO-001",
    "tier=T2",
    "task_id=T2-CRYPTO-1502",
    "D-001 CRYPTO-R006-OFF-PORTAL-ASSURANCE off_playbook_addition applied to R-006",
    "D-002 CRYPTO-R008-DEFINED-CUSTOMER-ASSETS defined_term_shift applied to R-008",
    "D-003 CRYPTO-R002-CROSS-IDLE-BALANCES cross_ref_override applied to R-002",
    "D-004 CRYPTO-R005-DIRECT-INSURANCE direct_term_swap applied to R-005",
    "D-005 CRYPTO-R003-OMISSION-ESTATE omission applied to R-003",
    "coherence_check PASS sections=15 cross_refs_resolved=yes anchors_resolved=yes",
    "distractor_check PASS registered=3 dropped_absent=none"
  ]
}
