{
  "deviations": [
    {
      "deviation_id": "D-001",
      "rule_id": "R-001",
      "doc_id": "DOC-01",
      "clause_anchor": {
        "section": "8",
        "span": "If Company terminates Executive's employment without Cause and not because of death or disability, Company will provide severance equal to 18 months of Executive's then-current base salary, paid in regular payroll installments, subject to Section 9."
      },
      "original_text": "If Company terminates Executive's employment without Cause and not because of death or disability, Company will provide severance equal to six months of Executive's then-current base salary, paid in regular payroll installments, subject to Section 9.",
      "mutated_text": "If Company terminates Executive's employment without Cause and not because of death or disability, Company will provide severance equal to 18 months of Executive's then-current base salary, paid in regular payroll installments, subject to Section 9.",
      "mechanism": "direct_term_swap",
      "severity": "high",
      "expected_action": "redline_with_fallback"
    },
    {
      "deviation_id": "D-002",
      "rule_id": "R-008",
      "doc_id": "DOC-01",
      "clause_anchor": {
        "section": "12",
        "span": "During employment and for 24 months after separation, Executive will not provide services to any business that competes with Company anywhere in North America."
      },
      "original_text": "During employment and for six months after separation, Executive will not provide substantially similar executive services to a business unit that directly competes with a Company product or service for which Executive had material responsibility, but only to the extent enforceable under applicable law.",
      "mutated_text": "During employment and for 24 months after separation, Executive will not provide services to any business that competes with Company anywhere in North America.",
      "mechanism": "direct_term_swap",
      "severity": "high",
      "expected_action": "redline_with_fallback"
    },
    {
      "deviation_id": "D-003",
      "rule_id": "R-013",
      "doc_id": "DOC-01",
      "clause_anchor": {
        "section": "9",
        "span": "All separation amounts will be paid in a lump sum within five business days after employment ends regardless of documentation timing or deferred-compensation requirements."
      },
      "original_text": "Severance will be paid only at times and in a manner that complies with Section 409A of the Internal Revenue Code or an available exemption, after the release condition is satisfied.",
      "mutated_text": "All separation amounts will be paid in a lump sum within five business days after employment ends regardless of documentation timing or deferred-compensation requirements.",
      "mechanism": "direct_term_swap",
      "severity": "medium",
      "expected_action": "redline_with_fallback"
    },
    {
      "deviation_id": "D-004",
      "rule_id": "R-011",
      "doc_id": "DOC-01",
      "clause_anchor": {
        "section": "15",
        "span": "Company will personally reimburse Executive for all employment-related claims, costs, judgments, settlements, and taxes without regard to Company governing documents, insurance terms, or applicable law."
      },
      "original_text": "Company will provide indemnification and D&O insurance coverage to Executive on the same basis as similarly situated officers, subject to Company's governing documents, policy terms, and applicable law.",
      "mutated_text": "Company will personally reimburse Executive for all employment-related claims, costs, judgments, settlements, and taxes without regard to Company governing documents, insurance terms, or applicable law.",
      "mechanism": "direct_term_swap",
      "severity": "medium",
      "expected_action": "redline_with_fallback"
    }
  ],
  "distractors": [
    {
      "distractor_id": "X-001",
      "doc_id": "DOC-01",
      "span": "Except for claims that cannot lawfully be arbitrated and claims for emergency injunctive relief, employment-related disputes will be resolved by individual arbitration before JAMS.",
      "why_benign": "The arbitration canary says individual arbitration of employment disputes is acceptable for this engagement."
    },
    {
      "distractor_id": "X-002",
      "doc_id": "DOC-01",
      "span": "This Agreement is governed by the laws of the State of Delaware, without regard to conflict-of-law rules.",
      "why_benign": "The governing-law canary says Delaware law is acceptable."
    },
    {
      "distractor_id": "X-003",
      "doc_id": "DOC-01",
      "span": "Company will pay Executive an annualized base salary of $250,000, less required withholdings and deductions, payable in accordance with Company's regular payroll practices.",
      "why_benign": "A market base salary paid through regular payroll is expected and does not conflict with the playbook."
    }
  ],
  "missing_info": [
    {
      "missing_info_id": "M-001",
      "topic": "Golden-parachute and Section 280G change-in-control tax exposure",
      "context_anchor": "Company anticipates acquisition interest during Executive's tenure and needs deal-readiness on golden-parachute and Section 280G exposure.",
      "match_keywords": [
        "280g",
        "parachute",
        "golden parachute",
        "change in control",
        "excise tax"
      ],
      "absent_terms": [
        "280g",
        "parachute",
        "golden parachute",
        "change in control",
        "excise tax"
      ],
      "expected_action": "escalate"
    }
  ],
  "generation_log": [
    "seed=711",
    "attempt_seed=711",
    "playbook=PB-EMP-001",
    "tier=T1",
    "task_id=T1-EMP-711",
    "D-001 EMP-R001-DIRECT-SEVERANCE-MULTIPLE direct_term_swap applied to R-001",
    "D-002 EMP-R008-DIRECT-NONCOMPETE-DURATION direct_term_swap applied to R-008",
    "D-003 EMP-R013-DIRECT-409A-TIMING direct_term_swap applied to R-013",
    "D-004 EMP-R011-DIRECT-INDEMNITY-EXPANSION direct_term_swap applied to R-011",
    "coherence_check PASS sections=15 cross_refs_resolved=yes anchors_resolved=yes"
  ]
}
